{
  "baseline_validation": {
    "decision_fixture": {
      "expected": true,
      "metric": "decision_fixture.valid",
      "observed": true,
      "passed": true
    },
    "decision_hash": {
      "expected": true,
      "metric": "decision_fixture.hash_valid",
      "observed": true,
      "passed": true
    },
    "deterministic_clock": {
      "expected": false,
      "metric": "scenario_wall_clock_dependency",
      "observed": false,
      "passed": true
    },
    "evidence_fixture": {
      "expected": true,
      "metric": "evidence_fixture.valid",
      "observed": true,
      "passed": true
    },
    "evidence_trust": {
      "expected": "ACCEPT",
      "metric": "evidence_fixture.trust_action",
      "observed": "ACCEPT_WITH_WARNINGS",
      "passed": true
    },
    "runtime_policy": {
      "expected": "1.0.0",
      "metric": "resilience_runtime_policy.version",
      "observed": "1.0.0",
      "passed": true
    },
    "step11c_report": {
      "expected": true,
      "metric": "summary.overall_passed",
      "observed": true,
      "passed": true
    },
    "step11d_report": {
      "expected": true,
      "metric": "summary.overall_passed",
      "observed": true,
      "passed": true
    },
    "step11e_report": {
      "expected": true,
      "metric": "summary.overall_passed",
      "observed": true,
      "passed": true
    },
    "step11f_report": {
      "expected": true,
      "metric": "summary.overall_passed",
      "observed": true,
      "passed": true
    },
    "step11g_report": {
      "expected": true,
      "metric": "summary.overall_passed",
      "observed": true,
      "passed": true
    }
  },
  "catalog": {
    "catalog_id": "AEGIS-RESILIENCE-FAULT-SCENARIO-CATALOG",
    "harness_version": "0.1.0",
    "relative_path": "policies/assurance/resilience_fault_scenario_catalog_v1.yaml",
    "sha256": "c6a613dc06504702a699abe627790f154fbd56f6c7f0b65506487ac2538d2b7e",
    "version": "1.0.0"
  },
  "deterministic_clock": {
    "evaluation_time": "2026-07-15T10:00:00+00:00",
    "sleep_based_retries_used": false,
    "wall_clock_reads_used_for_scenarios": false
  },
  "generated_at": "2026-07-15T11:44:51.806082+00:00",
  "harness_error_scenario_ids": [],
  "input_integrity_checks_after": {
    "assurance_corpus": {
      "actual_sha256": "d51747056c4f920d5e0b6bfb51613b4e1ee1910de82770aa179dd3fe77f68ded",
      "exists": true,
      "expected_sha256": "d51747056c4f920d5e0b6bfb51613b4e1ee1910de82770aa179dd3fe77f68ded",
      "passed": true,
      "relative_path": "data/assurance/step11a_policy_rule_coverage_corpus.jsonl",
      "safe_path": true
    },
    "assurance_manifest": {
      "actual_sha256": "d1fdd9308b973e5248e464daf528a376bca6bc6c27b9d45f267b88f842797465",
      "exists": true,
      "expected_sha256": "d1fdd9308b973e5248e464daf528a376bca6bc6c27b9d45f267b88f842797465",
      "passed": true,
      "relative_path": "data/assurance/step11a_policy_rule_coverage_manifest.json",
      "safe_path": true
    },
    "decision_fixture": {
      "actual_sha256": "7d557b127eb2cb6ae097be75273cad3e3d0cd0876385dd74d2439c762254f37a",
      "exists": true,
      "expected_sha256": "7d557b127eb2cb6ae097be75273cad3e3d0cd0876385dd74d2439c762254f37a",
      "passed": true,
      "relative_path": "data/sample_inputs/decisions/valid_log4shell_decision_record_policy.json",
      "safe_path": true
    },
    "decision_hashing_module": {
      "actual_sha256": "3b0a1eff5d2b97064d6dfb43936dde0bf2b1c23574a447afae13e2b02886853f",
      "exists": true,
      "expected_sha256": "3b0a1eff5d2b97064d6dfb43936dde0bf2b1c23574a447afae13e2b02886853f",
      "passed": true,
      "relative_path": "src/domain/decision_hashing.py",
      "safe_path": true
    },
    "decision_policy": {
      "actual_sha256": "fd5f39cec54f4bb57491d60bff9326f9b854209d3ab907cdab8768029a35447f",
      "exists": true,
      "expected_sha256": "fd5f39cec54f4bb57491d60bff9326f9b854209d3ab907cdab8768029a35447f",
      "passed": true,
      "relative_path": "policies/decision/federal_base_policy_v1.yaml",
      "safe_path": true
    },
    "decision_schema": {
      "actual_sha256": "e54a394ef9c772d3dce070f359051d6accf5761b1983ca9721e03e80a9e54ba3",
      "exists": true,
      "expected_sha256": "e54a394ef9c772d3dce070f359051d6accf5761b1983ca9721e03e80a9e54ba3",
      "passed": true,
      "relative_path": "schemas/aegis_decision_record.schema.json",
      "safe_path": true
    },
    "decision_validator": {
      "actual_sha256": "f1ef851a8f875680fc5e919b9276effc8d7c2feb00005b893f163ed47136806f",
      "exists": true,
      "expected_sha256": "f1ef851a8f875680fc5e919b9276effc8d7c2feb00005b893f163ed47136806f",
      "passed": true,
      "relative_path": "src/validation/decision_record_validator.py",
      "safe_path": true
    },
    "evidence_fixture": {
      "actual_sha256": "21ed78284567bc33bb463fb2525941829b80c7e21144d17677f022d168a3c2de",
      "exists": true,
      "expected_sha256": "21ed78284567bc33bb463fb2525941829b80c7e21144d17677f022d168a3c2de",
      "passed": true,
      "relative_path": "data/sample_inputs/evidence/valid_log4j_sbom_evidence.json",
      "safe_path": true
    },
    "evidence_schema": {
      "actual_sha256": "adaef9c4a1a837fddebee3d40cc03d6d99592682b3c42f1c24dded2fc74ce772",
      "exists": true,
      "expected_sha256": "adaef9c4a1a837fddebee3d40cc03d6d99592682b3c42f1c24dded2fc74ce772",
      "passed": true,
      "relative_path": "schemas/aegis_evidence_record.schema.json",
      "safe_path": true
    },
    "evidence_trust_engine": {
      "actual_sha256": "78943367308a8fcc07e085da0e45fe75013f216d23f0fac3f1e749f148c74fc7",
      "exists": true,
      "expected_sha256": "78943367308a8fcc07e085da0e45fe75013f216d23f0fac3f1e749f148c74fc7",
      "passed": true,
      "relative_path": "src/governance/evidence_trust_engine.py",
      "safe_path": true
    },
    "osv_client": {
      "actual_sha256": "26daa6892a852705f5dd2dc5c9f7ec9642ba4f5a6b5f8d5a2ba49290f027c83f",
      "exists": true,
      "expected_sha256": "26daa6892a852705f5dd2dc5c9f7ec9642ba4f5a6b5f8d5a2ba49290f027c83f",
      "passed": true,
      "relative_path": "src/intelligence/osv_client.py",
      "safe_path": true
    },
    "resilience_runtime_policy": {
      "actual_sha256": "c0449072f9dff7ec9991e1a9ba7dc1ddfd9a8791fbef19246e027821f3543387",
      "exists": true,
      "expected_sha256": "c0449072f9dff7ec9991e1a9ba7dc1ddfd9a8791fbef19246e027821f3543387",
      "passed": true,
      "relative_path": "policies/assurance/resilience_runtime_policy_v1.yaml",
      "safe_path": true
    },
    "step11c_report": {
      "actual_sha256": "74f0849ee40aa73f09b9abf23929bbaf4a355d51f00c9b01958b01f943867a23",
      "exists": true,
      "expected_sha256": "74f0849ee40aa73f09b9abf23929bbaf4a355d51f00c9b01958b01f943867a23",
      "passed": true,
      "relative_path": "data/validation_reports/tampering/step11c_tamper_assurance_report.json",
      "safe_path": true
    },
    "step11d_report": {
      "actual_sha256": "8c21529e07fa9b9b196a002d64fa302e7f9ec10da3e1fec9b7070bdd6d6b6f69",
      "exists": true,
      "expected_sha256": "8c21529e07fa9b9b196a002d64fa302e7f9ec10da3e1fec9b7070bdd6d6b6f69",
      "passed": true,
      "relative_path": "data/validation_reports/hostile_inputs/step11d_hostile_input_report.json",
      "safe_path": true
    },
    "step11e_report": {
      "actual_sha256": "18c1b8986c318a815d5d954df2686846b5d97ac30727fb94c24ac72e635e652e",
      "exists": true,
      "expected_sha256": "18c1b8986c318a815d5d954df2686846b5d97ac30727fb94c24ac72e635e652e",
      "passed": true,
      "relative_path": "data/validation_reports/metamorphic/step11e_metamorphic_assurance_report.json",
      "safe_path": true
    },
    "step11f_report": {
      "actual_sha256": "2b67f31c55bbe51ed52c83b8bba01fc8ad41b424b24f55d750d7bf2e6f03379f",
      "exists": true,
      "expected_sha256": "2b67f31c55bbe51ed52c83b8bba01fc8ad41b424b24f55d750d7bf2e6f03379f",
      "passed": true,
      "relative_path": "data/validation_reports/compound_attacks/step11f_compound_attack_report.json",
      "safe_path": true
    },
    "step11g_report": {
      "actual_sha256": "eb2a2f8f8de52b087e1a95dee123aca9cfb00bdb2344776aac2da156698b3de1",
      "exists": true,
      "expected_sha256": "eb2a2f8f8de52b087e1a95dee123aca9cfb00bdb2344776aac2da156698b3de1",
      "passed": true,
      "relative_path": "data/validation_reports/temporal/step11g_temporal_assurance_report.json",
      "safe_path": true
    },
    "temporal_guard": {
      "actual_sha256": "6172039fad2683f8d0c7dec8a279c20b123771277cdf37568cfe3e629ea077f9",
      "exists": true,
      "expected_sha256": "6172039fad2683f8d0c7dec8a279c20b123771277cdf37568cfe3e629ea077f9",
      "passed": true,
      "relative_path": "src/governance/temporal_guard.py",
      "safe_path": true
    },
    "trust_policy": {
      "actual_sha256": "6a4b41df0d5084bdc8a82c6c82714376253af9229ab1474dc73727d966359249",
      "exists": true,
      "expected_sha256": "6a4b41df0d5084bdc8a82c6c82714376253af9229ab1474dc73727d966359249",
      "passed": true,
      "relative_path": "policies/trust/evidence_trust_policy_v1.yaml",
      "safe_path": true
    }
  },
  "input_integrity_checks_before": {
    "assurance_corpus": {
      "actual_sha256": "d51747056c4f920d5e0b6bfb51613b4e1ee1910de82770aa179dd3fe77f68ded",
      "exists": true,
      "expected_sha256": "d51747056c4f920d5e0b6bfb51613b4e1ee1910de82770aa179dd3fe77f68ded",
      "passed": true,
      "relative_path": "data/assurance/step11a_policy_rule_coverage_corpus.jsonl",
      "safe_path": true
    },
    "assurance_manifest": {
      "actual_sha256": "d1fdd9308b973e5248e464daf528a376bca6bc6c27b9d45f267b88f842797465",
      "exists": true,
      "expected_sha256": "d1fdd9308b973e5248e464daf528a376bca6bc6c27b9d45f267b88f842797465",
      "passed": true,
      "relative_path": "data/assurance/step11a_policy_rule_coverage_manifest.json",
      "safe_path": true
    },